<?xml version="1.0" encoding="utf-8" ?>
<xs:schema xmlns:xs="http://www.w3.org/2001/XMLSchema"
           targetNamespace="https://www.w3schools.com"
           elementFormDefault="qualified"
           xmlns="https://www.w3schools.com">

    <xs:element name="teslaStocks">
        <xs:complexType>
            <xs:sequence>
                <xs:element name="teslaStock" type="TeslaStock" minOccurs="0" maxOccurs="unbounded" />
            </xs:sequence>
        </xs:complexType>
    </xs:element>

    <xs:complexType name="TeslaStock">
        <xs:sequence>
            <xs:element name="date" type="xs:long"/>
            <xs:element name="open" type="xs:double"/>
            <xs:element name="high" type="xs:double"/>
            <xs:element name="low" type="xs:double"/>
            <xs:element name="close" type="xs:double"/>
            <xs:element name="volume" type="xs:double"/>
            <xs:element name="adjClose" type="xs:double"/>
        </xs:sequence>
    </xs:complexType>
</xs:schema>